{
  "schema_version": "1.0",
  "generated_on": "2026-10-07",
  "author": "QA (AI-assisted)",
  "status": "Draft — pending review",
  "story": {
    "id": 1,
    "title": "Swag Labs login functionality",
    "type": "Issue",
    "url": "https://dev.azure.com/learnbydoing1/AIAgentsLearning/_workitems/edit/1",
    "state": "To Do"
  },
  "scope_summary": "Covers authentication on the Swag Labs (https://www.saucedemo.com/) login page: page elements, valid login and redirect to /inventory.html, invalid and missing credentials, the locked-out user, password masking, error visibility, and blocking direct access to the inventory page without a session. Username × password inputs were modelled as a decision table (each Valid / Invalid / Empty → 9 combinations); the story's ACs define 7 combinations, and the remaining 2 (Invalid username + Empty password, Empty username + Invalid password) are covered in TC-1-008 and TC-1-007. Main risks: unauthorized access to the inventory, and unclear or missing error feedback.",
  "out_of_scope": [
    "Logout, session timeout and 'remember me' behaviour (not part of this story)",
    "Behaviour of other Swag Labs demo users after login (problem_user, performance_glitch_user, error_user, visual_user); they belong to inventory/checkout stories",
    "Content and functionality of the Products/Inventory page beyond confirming the redirect",
    "Password reset or account registration (the application provides neither)",
    "Automated (Playwright) implementation; the story's automation note is for a separate task",
    "Cross-browser and mobile-device matrix (no compatibility requirement stated)"
  ],
  "requirements": [
    { "id": "AC-1", "text": "A user with valid credentials who clicks Login is authenticated and redirected to the Products page, and the URL contains /inventory.html.", "source": "description" },
    { "id": "AC-2", "text": "An invalid username with a valid password fails authentication; the user remains on the login page and an error message is displayed.", "source": "description" },
    { "id": "AC-3", "text": "A valid username with an invalid password fails authentication and an error message is displayed.", "source": "description" },
    { "id": "AC-4", "text": "An invalid username with an invalid password fails authentication; the user remains on the login page and an authentication error is displayed.", "source": "description" },
    { "id": "AC-5", "text": "With an empty username and a password entered, login does not proceed and 'Epic sadface: Username is required' is displayed.", "source": "description" },
    { "id": "AC-6", "text": "With a username entered and an empty password, login does not proceed and 'Epic sadface: Password is required' is displayed.", "source": "description" },
    { "id": "AC-7", "text": "With both fields empty, login does not proceed and the username-required message is displayed.", "source": "description" },
    { "id": "AC-8", "text": "A locked user entering valid credentials is rejected and a locked-user error message is displayed.", "source": "description" },
    { "id": "REQ-1", "text": "The login page contains a Username field, a Password field and a Login button.", "source": "description" },
    { "id": "REQ-2", "text": "Password characters are not displayed as plain text while being entered (Business Rule 6).", "source": "description" },
    { "id": "REQ-3", "text": "Invalid or missing credentials must not provide access to the inventory page (Business Rules 2, 3, 5).", "source": "description" },
    { "id": "REQ-4", "text": "Authentication errors are clearly visible to the user (Business Rule 7).", "source": "description" },
    { "id": "IMP-1", "text": "Credentials are matched exactly: a username differing in letter case or surrounding whitespace is not accepted.", "source": "implicit" },
    { "id": "IMP-2", "text": "Pressing Enter in the Password field submits the login form.", "source": "implicit" },
    { "id": "IMP-3", "text": "A user can log in successfully with valid credentials immediately after a failed attempt.", "source": "implicit" }
  ],
  "assumptions": [
    "Acceptance criteria are taken from the Description field because the ADO Acceptance Criteria field is empty; AC numbering follows the story (AC1–AC8 → AC-1–AC-8).",
    "Test environment is the public Swag Labs demo at https://www.saucedemo.com/ with its published demo accounts: standard_user and locked_out_user, password secret_sauce.",
    "Where the story says only 'an appropriate error message' (AC-2, AC-3, AC-4, AC-8), expected texts use the current Swag Labs messages: 'Epic sadface: Username and password do not match any user in this service' and 'Epic sadface: Sorry, this user has been locked out.'",
    "AC-3 does not state that the user remains on the login page; this is assumed, consistent with AC-2 and AC-4 and Business Rule 3.",
    "REQ-3: opening /inventory.html without logging in redirects to the login page and shows 'Epic sadface: You can only access '/inventory.html' when you are logged in.' (current application behaviour; not specified in the story).",
    "REQ-4: 'clearly visible' is interpreted as an error banner shown above the Login button without scrolling, with both input fields marked with an error icon, and a close (✖) button that dismisses the banner (current application design).",
    "IMP-1: usernames are case-sensitive and surrounding spaces are not trimmed (standard for this application; not stated in the story).",
    "IMP-2: Enter-key submission is a standard expectation of HTML login forms; not stated in the story.",
    "IMP-3: no lockout after a single failed attempt; the story defines locking only as an account configuration (AC-8)."
  ],
  "open_questions": [
    "The ADO Acceptance Criteria field is empty and the ACs are inside the Description. Should they be moved to the Acceptance Criteria field so they can be traced and reported on?",
    "AC-2, AC-3, AC-4 and AC-8 say 'appropriate error message' without exact text. Are the current Swag Labs messages (see assumptions) the approved wording?",
    "Should the username be case-insensitive or have surrounding whitespace trimmed? TC-1-013 currently expects both to be rejected.",
    "Is there a limit on failed login attempts (e.g. temporary lockout after N tries)? The story mentions only pre-configured locked accounts."
  ],
  "test_cases": [
    {
      "id": "TC-1-001",
      "title": "Verify standard user logs in and is redirected to the Products page",
      "objective": "Confirm the main success path: a registered user with valid credentials reaches the inventory page.",
      "type": "Functional",
      "technique": "Use Case / Scenario",
      "priority": 1,
      "requirement_refs": ["AC-1", "REQ-1"],
      "preconditions": ["Browser is open with no active Swag Labs session (cookies cleared or private window)."],
      "test_data": [
        { "name": "URL", "value": "https://www.saucedemo.com/" },
        { "name": "Username", "value": "standard_user" },
        { "name": "Password", "value": "secret_sauce" }
      ],
      "steps": [
        { "action": "Navigate to https://www.saucedemo.com/.", "expected": "The Swag Labs login page is displayed with a **Username** field, a **Password** field and a **Login** button." },
        { "action": "Enter 'standard_user' in **Username**." },
        { "action": "Enter 'secret_sauce' in **Password**." },
        { "action": "Click **Login**.", "expected": "The browser URL changes to https://www.saucedemo.com/inventory.html." },
        { "action": "Observe the page content.", "expected": "The page header shows 'Products', the product list is displayed, and no error message is shown." }
      ],
      "postconditions": [],
      "tags": ["smoke", "e2e"]
    },
    {
      "id": "TC-1-002",
      "title": "Reject login with an unregistered username and a valid password",
      "objective": "Verify that an invalid username alone causes authentication to fail without granting access.",
      "type": "Negative",
      "technique": "Equivalence Partitioning",
      "priority": 1,
      "requirement_refs": ["AC-2", "REQ-3"],
      "preconditions": ["Browser is on https://www.saucedemo.com/ with no active session."],
      "test_data": [
        { "name": "Username", "value": "invalid_user" },
        { "name": "Password", "value": "secret_sauce" }
      ],
      "steps": [
        { "action": "Enter 'invalid_user' in **Username** and 'secret_sauce' in **Password**." },
        { "action": "Click **Login**.", "expected": "The error 'Epic sadface: Username and password do not match any user in this service' is displayed." },
        { "action": "Check the browser URL and page content.", "expected": "The URL remains https://www.saucedemo.com/ and the Products page is not displayed." }
      ],
      "postconditions": [],
      "tags": ["regression"]
    },
    {
      "id": "TC-1-003",
      "title": "Reject login with a valid username and an incorrect password",
      "objective": "Verify that a wrong password for an existing account causes authentication to fail without granting access.",
      "type": "Negative",
      "technique": "Equivalence Partitioning",
      "priority": 1,
      "requirement_refs": ["AC-3", "REQ-3"],
      "preconditions": ["Browser is on https://www.saucedemo.com/ with no active session."],
      "test_data": [
        { "name": "Username", "value": "standard_user" },
        { "name": "Password", "value": "wrong_password" }
      ],
      "steps": [
        { "action": "Enter 'standard_user' in **Username** and 'wrong_password' in **Password**." },
        { "action": "Click **Login**.", "expected": "The error 'Epic sadface: Username and password do not match any user in this service' is displayed." },
        { "action": "Check the browser URL and page content.", "expected": "The URL remains https://www.saucedemo.com/ and the Products page is not displayed." }
      ],